<!ELEMENT students (student+)>
<!ELEMENT student (enrollment, name, mobile, email)>
<!ELEMENT enrollment (#PCDATA)>
<!ELEMENT name (#PCDATA)>
<!ELEMENT mobile (#PCDATA)>
<!ELEMENT email (#PCDATA)>
